{
  "slug": "mbti-personality-types-as-relatable-girl-problems-1755109801670",
  "title": "She's Just a Girl: MBTI Personality Types as Relatable Girl Problems (Instagram Edition)",
  "description": "“She’s just a girl who…” — and then the joke lands perfectly, the caption snaps, and 10,000 likes later you realize you’ve just tapped into a universal mood. Co",
  "content": "# She's Just a Girl: MBTI Personality Types as Relatable Girl Problems (Instagram Edition)\n\n## Introduction\n\n“She’s just a girl who…” — and then the joke lands perfectly, the caption snaps, and 10,000 likes later you realize you’ve just tapped into a universal mood. Combine that Gen Z meme energy with MBTI shorthand and you get one of the internet’s most addictive formats: personality-specific, hyper-relatable micro-humor that people tag their friends in. For the Instagram Personality Types crowd, this combo is gold: it teaches a little bit of psychology, validates feelings, and gives followers a dopamine hit when they read “that’s so me.”\n\nMBTI and 16personalities content is still thriving: people love labels that feel descriptive and fun. But to turn MBTI into viral “she’s just a girl” posts, creators need more than a punchline — they need data, nuance, and a strategy that respects personalities while leaning hard into the relatability factor. That means knowing which types are common (so your content reaches more people), which types are niche (so you can build tight-knit communities), and how gender distributions interact with “girl problems” humor.\n\nThis article blends the classic MBTI framework with the “she’s just a girl” meme format to give Instagram creators a field guide: what to post, how to caption, which types to prioritize for reach, and how to avoid the sticky traps of stereotyping. We’ll pull from existing MBTI distribution data (e.g., ISFJ and ESFJ being among the most common types), highlight which types generate broad vs niche appeal, and include sample meme lines and content templates you can drop straight into your feed or carousel. Expect practical posting advice, hashtag strategies (yes — use 16personalities), and a short set of ethics tips so your relatability never becomes reductive.\n\nIf you’re running an account that curates MBTI content (shoutout to micro-influencers like @mbti.types with ~15K followers), or you want to start repurposing personality theory into shareable “girl problems” jokes, this post will map the terrain and give you actionable takeaways. Let’s make MBTI feel like a group chat — witty, validating, and oddly specific.\n\n## Understanding MBTI + “She’s Just a Girl” Culture\n\nMBTI (Myers-Briggs Type Indicator) is a personality framework many people use casually to describe preferences in cognition and behavior: extraversion vs introversion, sensing vs intuition, thinking vs feeling, judging vs perceiving. Sites like 16personalities have popularized MBTI shorthand, turning four-letter types into badges people wear online. That simplification is a feature — and a risk. The “she’s just a girl” meme format thrives on simple, instantly recognizable tropes. Marrying the two creates instantly digestible content, but it’s important to ground that content in real distribution and audience patterns so your posts land with maximum relatability.\n\nKey data points to know:\n- ISFJ is the most common personality type at 13.8% of the U.S. population, followed by ESFJ at 12.3%. The four most common types (ISFJ, ESFJ, ISTJ, ISFP) together account for roughly 46.5% of people. That’s nearly half the population, and it explains why posts about these types get big reach: a lot of people can nod and tag a friend.\n- Gender patterns matter for “girl problems” content. Feeling (F) preferences are more common among women; Thinking (T) preferences are more common among men. That skew is relevant because “she’s just a girl” jokes usually aim at a predominantly female audience — so F-type content often resonates more broadly in this niche.\n- NF types (Intuitive-Feeling) collectively represent about 16.5% of the population. These are the dreamy, identity-driven posts people love to save and share for moodboard energy.\n- ENFP sits at about 8.1% — a common intuitive extrovert archetype that maps well to chaotic, bubbly “girl energy” posts.\n- The rarest types that drive niche fandom include INFJ (1.5%), ENTJ (1.8%), INTJ (2.6%), and ENTP (4.3%). Posts that lean into rare-type specificity often generate passionate engagement from smaller, more loyal audiences.\n- ST (Sensing-Thinking) types account for roughly 30% of the population. Practical, “I can’t believe she did this” content aimed at everyday annoyances can resonate widely when you target ST traits.\n\nFinally, while MBTI is a cultural staple, be aware that the most comprehensive distribution data available in recent research dates to November 2024; specific trending stats for the last 30 days or for early 2025 within this emerging MBTI/meme niche are limited. Accounts like @mbti.types (around 15K followers) are examples of current players, but the space is dynamic — real-time social metrics will tell you more about what’s working than any snapshot statistic.\n\nKnowing this, you can design “she’s just a girl” posts that are both funny and strategic: prioritize common types for reach, use rare types to build niche loyalty, and skew toward Feeling-type narratives when aiming for the stereotypical “girl problems” audience — but do so thoughtfully.\n\n## Key Components and Analysis\n\nWhy does “she’s just a girl” plus MBTI work so well? Break it down and the answer is a mix of cognitive shortcuts, social identity, and emotional validation.\n\n1. Cognitive shorthand: MBTI’s four-letter system compresses complex behavior into a punchable chunk. Add “she’s just a girl who…” and the brain fills in the rest instantly. It’s meme-friendly because people don’t need a deep explanation to get the joke.\n\n2. Identity and community: MBTI functions like fandom. Calling out a type is an invitation to bond. “She’s just a girl who overanalyzes everything” becomes a private handshake between INFJs and their sympathizers. People tag friends to say, “This is you,” and that tag is engagement.\n\n3. Gendered resonance: Because Feeling (F) types skew more female, “girl problems” that hinge on emotional responsiveness, social exhaustion, or relationship anxieties hit harder with an audience that self-identifies with F-preferences. Using that pattern gets you more saves and comments — but requires ethical framing (more below).\n\n4. Prevalence vs niche trade-off: The data tells us where to aim for scale. ISFJ (13.8%), ESFJ (12.3%), ISTJ, and ISFP collectively make up about 46.5% — so content based on everyday social anxieties, caretaking burnout, or sensory overwhelm hits big. Conversely, INFJ (1.5%) and ENTJ (1.8%) offer smaller but more engaged communities; niche specificity can grow a loyal audience faster.\n\n5. Emotional archetypes map to content types:\n   - Feeling (F) => relationship drama, validation, social exhaustion, people-pleasing “girl” problems.\n   - Intuitive (N) => identity crises, existential humor, creative chaos.\n   - Sensing (S) => concrete “adulting” problems: losing keys, messy rooms, deadline freakouts.\n   - Judging (J) => control, planning, list-related stress; Perceiving (P) => spontaneity, procrastination, FOMO.\n\n6. Visual and tone cues matter: Bright pastel aesthetics, handwritten fonts, and slightly chaotic layouts work for ENFP/INFP energy. Clean, neutral palettes and structured layouts suit ISFJ/ISTJ content. This alignment of visual style to type identity helps your meme feel like home to its intended audience.\n\n7. Engagement mechanics: The best “she’s just a girl” memes ask for a micro-action — tag a friend, save if this is you, or comment “same.” Adding a micro-poll (“Which one are you?”) or a two-slide carousel that flips the joke into a validation tip (e.g., “she’s just a girl who overthinks — here’s a 30-second grounding trick”) combines entertainment with value, increasing saves and shares.\n\n8. Ethical nuance: MBTI is popular but contested in scientific circles. The social value is real — self-understanding and belonging — but content that treats types as destiny, or that reinforces negative gender stereotypes, can alienate audiences. The analytics advantage (more likes from Feeling-oriented “girl problems”) must be weighed against long-term trust and inclusivity.\n\nPut simply: the sweet spot is specificity + validation + aesthetics. Use population data to choose which jokes will reach more people, use tone and visuals that match the type, and always include a small nod to nuance or self-care to avoid turning a mood post into a harmful stereotype.\n\n## Practical Applications (Templates, Examples, and Strategy)\n\nReady to post? Here are concrete templates, sample captions, and posting strategies that blend MBTI with the “she’s just a girl” meme style. Use these to streamline content production for Instagram, Reels, and carousels.\n\nA. Quick format templates (post ideas)\n- Single-image meme: “She’s just a girl who… [one-line type joke]” — great for feed grid consistency.\n- Carousel: Slide 1 — the meme line. Slide 2 — a short validation or mini-tip. Slide 3 — CTA (“Tag the ISFJ who will save this”).\n- Reel (10–20s): Text overlay with a quick skit showing the type’s problem, soundtrack aligned with the mood, caption with relevant hashtags.\n- Story poll: “Which type does this fit?” with two type options, then share results to boost visibility.\n\nB. Sample one-liners (drop-in “she’s just a girl who…” for the 16 types)\n- ISTJ: “She’s just a girl who scheduled her own missing-socks investigation.”\n- ISFJ: “She’s just a girl who stayed late to help everyone and forgot to eat.”\n- INFJ: “She’s just a girl who’s been rewriting her future in her head since 2017.”\n- INTJ: “She’s just a girl who has already optimized her breakup algorithm.”\n- ISTP: “She’s just a girl who fixed that noisy faucet at 2 AM and left.”\n- ISFP: “She’s just a girl who bought plants to heal emotionally and now they’re thriving.”\n- INFP: “She’s just a girl who cried at a sunset and took notes for her novel.”\n- INTP: “She’s just a girl who explained the plot hole in your favorite show and then apologized.”\n- ESTP: “She’s just a girl who turned ‘let’s go out’ into a five-hour adventure.”\n- ESFP: “She’s just a girl who’s the party and the cleanup crew.”\n- ENFP: “She’s just a girl who started three hobby projects and loved them all yesterday.”\n- ENTP: “She’s just a girl who argued with her reflection for intellectual clarity.”\n- ESTJ: “She’s just a girl who scheduled everyone’s birthdays and color-coded the cake.”\n- ESFJ: “She’s just a girl who remembers the group chat member’s mom’s name.”\n- ENFJ: “She’s just a girl who organized the friend reunion and made people cry (in a good way).”\n- ENTJ: “She’s just a girl who scheduled a board meeting for her feelings.”\n\nC. Caption and CTA formulas (mix humor + engagement)\n- Humor + validation + CTA: “She’s just a girl who stayed for the group project. Tag the ISFJ friend who’s secretly carrying the team. #16personalities #MBTI #shesjustagirl #relatablecontent”\n- Humor + micro-value + save CTA: “She’s just a girl who overthinks deadlines. Save this 2-step grounding trick for when your brain won’t let you plan. #personalitytypes”\n- Poll + tag: “Which one is your sister?” with options and “Tag her if it’s true.”\n\nD. Hashtag and keyword strategy\n- Use the primary keywords: 16personalities, MBTI, personality types, she’s just a girl, relatable content.\n- Combine general tags for reach (#MBTI, #personalitytypes, #relatable) with niche tags for community (#INFJproblems, #ESFJ, #ENFPenergy).\n- Caption SEO: start with the meme line, then include keywords naturally in the first 1–2 lines to improve discoverability on Instagram.\n\nE. Content cadence and targeting\n- Post high-reach types (ISFJ, ESFJ, ISTJ, ISFP) 60% of the time for discoverability.\n- Post niche types (INFJ, ENTJ, INTJ, ENTP) 20% for community building and deeper engagement.\n- Rotate NF/NT/SF/ST themes across the week to capture different energy sets (mood posts for NFs, practical life tips for STs).\n- Use Stories and polls to test which type-lines resonate — convert top performers into Reels.\n\nF. Visual and audio cues\n- ENFP/INFP reels: pastel filters, lo-fi or upbeat indie tracks, candid shots.\n- ISFJ/ISTJ posts: neutrals, clean typefaces, structured layouts.\n- Use consistent fonts and color palettes per type-category to create sub-branded content that followers recognize instantly.\n\nG. Analytics and iteration\n- Monitor Saves and Shares (strong indicators of long-term value).\n- Use A/B caption testing: test two CTAs to see which yields more tags.\n- Track type-based engagement: which type posts get more comments? That shows where your community is strongest.\n\nH. Example content calendar (one week)\n- Mon: ISFJ meme + carousel validation (reach-focused)\n- Tue: ENFP Reel (high share potential)\n- Wed: INFJ micro-essay (niche deep engagement)\n- Thu: ST life-hack post (practical value)\n- Fri: Weekend energy ENFP/ESFP meme (viral vibe)\n- Sat: Story poll — which type relates most?\n- Sun: Round-up post with CTA to follow-tag friends\n\n## Challenges and Solutions\n\nTurning MBTI-based “girl problems” into a sustainable content stream is fun, but creators face real pitfalls. Here are common challenges and concrete solutions you can implement.\n\n1. Oversimplification and stereotyping\n   - Problem: Reducing people to caricatures (e.g., “ENFP is chaotic and irresponsible”) can alienate followers and spread misinformation.\n   - Solution: Include a small line of nuance in captions: “This is a vibe, not a rule.” Mix humor posts with occasional educational content explaining MBTI basics and emphasizing that types are preferences, not destiny.\n\n2. Reinforcing gender stereotypes\n   - Problem: “She’s just a girl” memes can unintentionally essentialize women’s experiences or exclude trans and nonbinary audiences.\n   - Solution: Use inclusive language in captions (“they” as a neutral alternative when appropriate), and occasionally feature “he’s just a guy” or neutral versions. Highlight that Feeling preferences are not tied to gender, even if patterns exist in population data.\n\n3. MBTI as pseudoscience and backlash\n   - Problem: Some audiences criticize MBTI’s scientific validity and may push back on personality-based content.\n   - Solution: Acknowledge the critique in a light, respectful way: “MBTI is one lens, not the whole story.” Offer value beyond labeling — small tips, grounding exercises, or relationship strategies that anyone can use.\n\n4. Content fatigue and repetition\n   - Problem: Repetitive “she’s just a girl” jokes can get stale.\n   - Solution: Rotate formats — carousels, Reels, short essays, interviews with personality-typed creators. Refresh visuals and test new audio trends.\n\n5. Community toxicity and gatekeeping\n   - Problem: Type-based gatekeeping (e.g., “you’re not a true INFJ”) can lead to drama.\n   - Solution: Create community rules in captions or in Highlights. Encourage curiosity, not exclusion. Spotlight diverse interpretations of each type.\n\n6. Data limitations for strategy\n   - Problem: Limited 30-day and 2025 niche trend data makes real-time optimization hard.\n   - Solution: Use micro-analytics (your account’s reach by post type, Saves, Shares) to make decisions. Follow influencer accounts like @mbti.types to spot emergent trends and mimic formats that work.\n\n7. Monetization without selling out\n   - Problem: Turning relatable memes into quick merch can feel inauthentic if not executed carefully.\n   - Solution: Build trust first. Use merch to celebrate inside jokes in tasteful designs. Offer high-value digital products (type-based planners, guides) that extend the meme into usefulness.\n\n8. Protecting mental health\n   - Problem: “Girl problems” posts can sometimes trivialize or trigger serious issues (anxiety, eating disorders).\n   - Solution: Implement trigger warnings where appropriate and include resources in captions for serious topics. Balance humor with a genuine focus on well-being.\n\nBy addressing these challenges proactively, you strengthen your community and keep content fresh and respectful — which translates into long-term growth over short-lived virality.\n\n## Future Outlook\n\nWhere does the MBTI + “she’s just a girl” meme trend go next? A few converging signals suggest the format will evolve along three axes: personalization, education, and monetization — all driven by short-form social metrics.\n\n1. Hyper-personalization: Expect more template-based content that adapts to individual followers. Think quiz-driven carousels that produce personalized “she’s just a girl who…” lines based on a mini-survey. Instagram’s interactive features (polls, quizzes, DM automations) make this practical and sticky.\n\n2. Edutainment hybrid: The audience increasingly favors content that entertains and teaches. Creators who pair a joke with a micro-lessons (“Why ISFJs people-please and how to set boundaries”) will outperform pure meme accounts. This blends MBTI explanations with mental health and self-management tools.\n\n3. Cross-platform growth and short-form video dominance: Reels and TikTok will continue to amplify the format. Viral Reels that riff on MBTI stereotypes — especially with trending audio — will bleed followers to Instagram feeds and vice versa. Accounts like @mbti.types show that niche curation can scale; creators who master both static and video formats will win.\n\n4. AI-assisted content creation: Tools that generate type-specific captions, image variations, or meme templates will speed up production. Use AI to brainstorm lines or caption alternatives, but always human-edit to ensure nuance and authenticity.\n\n5. Niche communities and micro-merch: As algorithmic distribution favors smaller, engaged communities, expect more creators to launch merch, e-books, and paid guides tailored to specific types (e.g., “INFJ self-care planner”). These offerings convert loyal followers into paying fans.\n\n6. Ethical and scientific scrutiny: As the audience matures, there will be more demand for content that recognizes MBTI’s limits. Transparent creators who note the difference between personality preference models and clinical psychology will retain trust.\n\n7. New metrics matter: Save rate, sticker taps, and DM replies will become more important than likes. Posts designed to generate conversation (e.g., “tell me your best INFJ cringe”) will be prioritized by creators aiming for community, not just reach.\n\nLimitations to watch: We do not currently have extensive real-time statistics for the last 30 days or detailed 2025 metrics specific to the MBTI–“girl problems” niche; most comprehensive MBTI distribution data referenced here dates to November 2024. That means creators should prioritize their own micro-data (post-level analytics) to guide content pivots.\n\nOpportunities: The data shows ISFJ and ESFJ content will reach more people, NF posts appeal to identity-driven audiences, and rare type content nurtures highly engaged sub-communities. Combine that with interactive Instagram features and you’re positioned to scale both reach and depth.\n\n## Conclusion\n\nThe “she’s just a girl” meme plus MBTI is more than a passing trend — it’s a content architecture that taps into identity, belonging, and humor. Use the population data to inform your reach strategy: ISFJ (13.8%) and ESFJ (12.3%) content will likely get broad traction because those types are common; NF-type posts (16.5% collective) deliver dreamy, shareable vibes; rare types like INFJ (1.5%) and ENTJ (1.8%) create fiercely loyal micro-communities. Remember that Feeling (F) types skew more female, and ST types make up about 30% of the population — these patterns should inform your tone and topic choices on Instagram.\n\nActionable takeaways:\n- Prioritize common types for reach (ISFJ, ESFJ, ISTJ, ISFP — ~46.5%); post these 60% of the time.\n- Use niche, specific type posts for community-building (INFJ, ENTJ, INTJ, ENTP).\n- Pair each joke with a tiny piece of value (a grounding tip or nuance line) to reduce stereotyping complaints.\n- Use hashtags and keywords: 16personalities, MBTI, personality types, she’s just a girl, relatable content.\n- Monitor Saves and Shares — they matter more than likes for long-term growth.\n- Stay inclusive: avoid rigid gender stereotyping and provide occasional educational content explaining MBTI limits.\n\nIf you run an Instagram Personality Types account, a simple experiment to start: create a week-long series where each day targets a different temperament (NF, NT, SF, ST), test which day gets the most saves and comments, then scale accordingly. Follow accounts like @mbti.types for inspiration, but let your analytics guide your content mix.\n\nMake people laugh, make them feel seen, and make your page the kind of community where followers tag friends, come back for the mood, and leave with something a little more useful than a laugh — whether that’s validation, a coping trick, or a gentle reminder that their personality is a lens, not a label.",
  "category": "Instagram Personality Types",
  "keywords": [
    "16personalities",
    "MBTI",
    "personality types",
    "she's just a girl",
    "relatable content"
  ],
  "tags": [
    "16personalities",
    "MBTI",
    "personality types",
    "she's just a girl",
    "relatable content"
  ],
  "publishedAt": "2025-08-13T18:30:01.670Z",
  "updatedAt": "2025-08-13T18:30:01.670Z",
  "author": {
    "name": "Roast Team",
    "bio": "Expert content creators powered by AI and data-driven insights"
  },
  "metrics": {
    "readingTime": 15,
    "wordCount": 3212
  }
}